{
  "$schema": "https://json-schema.org/draft/2020-12/schema",
  "type": "object",
  "additionalProperties": false,
  "required": [
    "schema_version",
    "skill",
    "language",
    "context",
    "sources",
    "content"
  ],
  "properties": {
    "schema_version": {
      "const": "1.0"
    },
    "skill": {
      "const": "tw-edu-learning-evidence-analyzer"
    },
    "language": {
      "const": "zh-TW"
    },
    "context": {
      "type": "object",
      "additionalProperties": false,
      "required": [
        "subject",
        "grade",
        "topic"
      ],
      "properties": {
        "subject": {
          "type": "string",
          "minLength": 1
        },
        "grade": {
          "type": "string",
          "minLength": 1
        },
        "topic": {
          "type": "string",
          "minLength": 1
        }
      }
    },
    "sources": {
      "type": "array",
      "items": {
        "type": "object",
        "additionalProperties": false,
        "required": [
          "title",
          "status"
        ],
        "properties": {
          "title": {
            "type": "string",
            "minLength": 1
          },
          "url": {
            "type": "string"
          },
          "status": {
            "enum": [
              "verified",
              "user_provided",
              "pending"
            ]
          }
        }
      }
    },
    "content": {
      "type": "object",
      "additionalProperties": false,
      "properties": {
        "title": {
          "type": "string",
          "minLength": 1
        },
        "items": {
          "type": "array",
          "items": {
            "type": "object",
            "additionalProperties": false,
            "properties": {
              "id": {
                "type": "string",
                "minLength": 1
              },
              "target": {
                "type": "string",
                "minLength": 1
              },
              "answer": {
                "type": [
                  "string",
                  "null"
                ]
              },
              "key_status": {
                "enum": [
                  "verified",
                  "pending",
                  "ambiguous"
                ]
              },
              "options": {
                "type": "array",
                "items": {
                  "type": "string",
                  "minLength": 1
                }
              }
            },
            "required": [
              "id",
              "target",
              "answer",
              "key_status"
            ]
          }
        },
        "responses": {
          "type": "array",
          "items": {
            "type": "object",
            "additionalProperties": false,
            "properties": {
              "student_id": {
                "type": "string",
                "minLength": 1
              },
              "answers": {
                "type": "object",
                "additionalProperties": {
                  "type": [
                    "string",
                    "null"
                  ]
                }
              }
            },
            "required": [
              "student_id",
              "answers"
            ]
          }
        }
      },
      "required": [
        "title",
        "items",
        "responses"
      ]
    }
  }
}
